{
  "$schema": "https://json-schema.org/draft/2020-12/schema",
  "title": "AGORAFLUX Country Profile",
  "type": "object",
  "required": [
    "country_id",
    "nom_pays",
    "english_name",
    "continent",
    "niveau_risque_global",
    "barometre_risques",
    "donnees_cles",
    "situation_securitaire",
    "geopolitique",
    "politique",
    "socio_economique",
    "criminalite",
    "terrorisme",
    "sanitaire_catastrophes",
    "deplacements",
    "analyse_par_zones",
    "synthese"
  ],
  "properties": {
    "country_id": {
      "type": "string",
      "pattern": "^[A-Z]{3}$"
    },
    "nom_pays": {
      "type": "string",
      "minLength": 1
    },
    "english_name": {
      "type": "string",
      "minLength": 1
    },
    "continent": {
      "type": "string",
      "enum": [
        "Afrique",
        "Amérique du Nord",
        "Amérique du Sud",
        "Asie",
        "Europe",
        "Océanie",
        "Antarctique"
      ]
    },
    "niveau_risque_global": {
      "type": "integer",
      "minimum": 1,
      "maximum": 5
    },
    "barometre_risques": {
      "type": "object",
      "required": [
        "geopolitique",
        "politique",
        "socio_economique",
        "criminalite",
        "terrorisme",
        "sanitaire_catastrophes",
        "deplacements"
      ],
      "additionalProperties": false,
      "properties": {
        "geopolitique": {
          "type": "integer",
          "minimum": 1,
          "maximum": 5
        },
        "politique": {
          "type": "integer",
          "minimum": 1,
          "maximum": 5
        },
        "socio_economique": {
          "type": "integer",
          "minimum": 1,
          "maximum": 5
        },
        "criminalite": {
          "type": "integer",
          "minimum": 1,
          "maximum": 5
        },
        "terrorisme": {
          "type": "integer",
          "minimum": 1,
          "maximum": 5
        },
        "sanitaire_catastrophes": {
          "type": "integer",
          "minimum": 1,
          "maximum": 5
        },
        "deplacements": {
          "type": "integer",
          "minimum": 1,
          "maximum": 5
        }
      }
    },
    "donnees_cles": {
      "type": "object"
    },
    "situation_securitaire": {
      "type": "string"
    },
    "geopolitique": {
      "type": "string"
    },
    "politique": {
      "type": "string"
    },
    "socio_economique": {
      "type": "string"
    },
    "criminalite": {
      "type": "string"
    },
    "terrorisme": {
      "type": "string"
    },
    "sanitaire_catastrophes": {
      "type": "string"
    },
    "deplacements": {
      "type": "string"
    },
    "analyse_par_zones": {
      "type": "array",
      "minItems": 1,
      "items": {
        "type": "object",
        "required": [
          "zone",
          "niveau_risque",
          "analyse"
        ],
        "additionalProperties": false,
        "properties": {
          "zone": {
            "type": "string",
            "minLength": 1
          },
          "niveau_risque": {
            "type": "integer",
            "minimum": 1,
            "maximum": 5
          },
          "analyse": {
            "type": "string",
            "minLength": 1
          }
        }
      }
    },
    "synthese": {
      "type": "string"
    },
    "metadata": {
      "type": "object"
    }
  },
  "additionalProperties": false
}
